[
  {
    "id": "photoreal-daylight",
    "name": "Photoreal daylight",
    "kind": "lighting",
    "atmosphere": "neutral daylight",
    "palette": [
      "limestone",
      "clear glass",
      "neutral plaster"
    ],
    "roughness_start_range": [
      0.45,
      0.8
    ],
    "displacement_relief_mm": [
      0.1,
      0.6
    ],
    "lighting_recipe": "Large sky fill plus one consistent sun; keep interiors readable without flattening contrast.",
    "camera_guidance": "Perspective, 28–50 mm full-frame equivalent; level verticals only when reference supports it.",
    "post_guidance": "Neutral WB; restrained highlight compression.",
    "acceptance": "Crisp contact shadows, plausible window reflections, no clipped white facade.",
    "avoid": "Do not whiten every material or add a second contradictory sun.",
    "geometry_policy": "Preserve footprint, openings, storeys and camera unless user authorizes redesign",
    "execution_support": "Art direction + recipe JSON; native host changes require the relevant skill",
    "image_prompt": "Reinterpret the supplied architectural reference as photoreal daylight. Use limestone, clear glass, neutral plaster. Large sky fill plus one consistent sun; keep interiors readable without flattening contrast. Keep the building silhouette, window positions, perspective and image crop. Neutral WB; restrained highlight compression."
  },
  {
    "id": "blue-hour",
    "name": "Blue hour",
    "kind": "lighting",
    "atmosphere": "cool dusk",
    "palette": [
      "cool concrete",
      "warm timber",
      "low-iron glass"
    ],
    "roughness_start_range": [
      0.35,
      0.75
    ],
    "displacement_relief_mm": [
      0.1,
      0.8
    ],
    "lighting_recipe": "Cool sky plus 2700–3200 K luminaires, separated into interior/exterior groups.",
    "camera_guidance": "Lock reference pose; small exposure changes before changing lamp output.",
    "post_guidance": "Preserve blue exterior and warm interior separation; modest bloom.",
    "acceptance": "Visible fixtures retain shape; glass reveals depth and reflected sky.",
    "avoid": "Do not compensate dark foliage with neon green albedo.",
    "geometry_policy": "Preserve footprint, openings, storeys and camera unless user authorizes redesign",
    "execution_support": "Art direction + recipe JSON; native host changes require the relevant skill",
    "image_prompt": "Reinterpret the supplied architectural reference as blue hour. Use cool concrete, warm timber, low-iron glass. Cool sky plus 2700–3200 K luminaires, separated into interior/exterior groups. Keep the building silhouette, window positions, perspective and image crop. Preserve blue exterior and warm interior separation; modest bloom."
  },
  {
    "id": "golden-hour",
    "name": "Golden hour",
    "kind": "lighting",
    "atmosphere": "low warm sun",
    "palette": [
      "warm stone",
      "oak",
      "satin metal"
    ],
    "roughness_start_range": [
      0.35,
      0.7
    ],
    "displacement_relief_mm": [
      0.1,
      0.6
    ],
    "lighting_recipe": "One low directional sun; warm key and cooler sky fill; choose shadow direction from reference.",
    "camera_guidance": "Frame for long shadows; retain focal length across variants.",
    "post_guidance": "Warm highlights, neutral midtones, soft shoulder.",
    "acceptance": "Sun direction agrees with shadows, reflections and illuminated facades.",
    "avoid": "Do not turn all surfaces orange or paint shadows into albedo.",
    "geometry_policy": "Preserve footprint, openings, storeys and camera unless user authorizes redesign",
    "execution_support": "Art direction + recipe JSON; native host changes require the relevant skill",
    "image_prompt": "Reinterpret the supplied architectural reference as golden hour. Use warm stone, oak, satin metal. One low directional sun; warm key and cooler sky fill; choose shadow direction from reference. Keep the building silhouette, window positions, perspective and image crop. Warm highlights, neutral midtones, soft shoulder."
  },
  {
    "id": "overcast-soft",
    "name": "Soft overcast",
    "kind": "lighting",
    "atmosphere": "diffuse overcast",
    "palette": [
      "pale concrete",
      "weathered wood",
      "matte stone"
    ],
    "roughness_start_range": [
      0.5,
      0.85
    ],
    "displacement_relief_mm": [
      0.2,
      1
    ],
    "lighting_recipe": "Large diffuse sky, no strong direct sun; maintain contact and recess shading.",
    "camera_guidance": "Architectural perspective; add depth with occlusion and scale, not fake wide-angle stretch.",
    "post_guidance": "Soft contrast, restrained saturation.",
    "acceptance": "Open shadows retain depth; no hard cast sun shadow.",
    "avoid": "Do not add ambient occlusion halos around every edge.",
    "geometry_policy": "Preserve footprint, openings, storeys and camera unless user authorizes redesign",
    "execution_support": "Art direction + recipe JSON; native host changes require the relevant skill",
    "image_prompt": "Reinterpret the supplied architectural reference as soft overcast. Use pale concrete, weathered wood, matte stone. Large diffuse sky, no strong direct sun; maintain contact and recess shading. Keep the building silhouette, window positions, perspective and image crop. Soft contrast, restrained saturation."
  },
  {
    "id": "rainy-cinematic",
    "name": "Rainy cinematic",
    "kind": "lighting",
    "atmosphere": "wet dusk",
    "palette": [
      "wet stone",
      "dark metal",
      "coated glass"
    ],
    "roughness_start_range": [
      0.08,
      0.6
    ],
    "displacement_relief_mm": [
      0.1,
      0.6
    ],
    "lighting_recipe": "Broad cool environment with warm practical sources; physically placed wetness masks.",
    "camera_guidance": "Keep horizon and reflections consistent; low camera only if requested.",
    "post_guidance": "Subtle haze and highlight bloom; retain readable blacks.",
    "acceptance": "Wetness pools in plausible areas; roughness varies with drainage/exposure.",
    "avoid": "Do not make every surface a perfect mirror; rain must not change building geometry.",
    "geometry_policy": "Preserve footprint, openings, storeys and camera unless user authorizes redesign",
    "execution_support": "Art direction + recipe JSON; native host changes require the relevant skill",
    "image_prompt": "Reinterpret the supplied architectural reference as rainy cinematic. Use wet stone, dark metal, coated glass. Broad cool environment with warm practical sources; physically placed wetness masks. Keep the building silhouette, window positions, perspective and image crop. Subtle haze and highlight bloom; retain readable blacks."
  },
  {
    "id": "night-architectural",
    "name": "Architectural night",
    "kind": "lighting",
    "atmosphere": "night",
    "palette": [
      "dark stone",
      "emissive fixtures",
      "transparent glazing"
    ],
    "roughness_start_range": [
      0.25,
      0.7
    ],
    "displacement_relief_mm": [
      0.1,
      0.8
    ],
    "lighting_recipe": "Exterior fixtures, interior luminaires and environment in separate LightMix groups; finite output.",
    "camera_guidance": "Reference camera and visible fixture layout locked.",
    "post_guidance": "Control fireflies and clipping before denoising; gentle bloom.",
    "acceptance": "Light sources explain illuminated surfaces; unlit surfaces remain plausible.",
    "avoid": "Do not use emission as a substitute for all indirect lighting.",
    "geometry_policy": "Preserve footprint, openings, storeys and camera unless user authorizes redesign",
    "execution_support": "Art direction + recipe JSON; native host changes require the relevant skill",
    "image_prompt": "Reinterpret the supplied architectural reference as architectural night. Use dark stone, emissive fixtures, transparent glazing. Exterior fixtures, interior luminaires and environment in separate LightMix groups; finite output. Keep the building silhouette, window positions, perspective and image crop. Control fireflies and clipping before denoising; gentle bloom."
  },
  {
    "id": "scandinavian",
    "name": "Scandinavian calm",
    "kind": "design",
    "atmosphere": "soft daylight",
    "palette": [
      "light ash",
      "wool",
      "chalk plaster",
      "muted grey"
    ],
    "roughness_start_range": [
      0.5,
      0.9
    ],
    "displacement_relief_mm": [
      0.05,
      0.4
    ],
    "lighting_recipe": "Diffuse daylight and restrained 3000 K practicals.",
    "camera_guidance": "Eye-level, calm composition and moderate focal length.",
    "post_guidance": "Neutral whites, soft contrast, restrained warm timber.",
    "acceptance": "Wood grain has real scale; woven materials differ from plaster.",
    "avoid": "Preserve floor plan; avoid sterile white clipping and generic oversized furniture.",
    "geometry_policy": "Preserve footprint, openings, storeys and camera unless user authorizes redesign",
    "execution_support": "Art direction + recipe JSON; native host changes require the relevant skill",
    "image_prompt": "Reinterpret the supplied architectural reference as scandinavian calm. Use light ash, wool, chalk plaster, muted grey. Diffuse daylight and restrained 3000 K practicals. Keep the building silhouette, window positions, perspective and image crop. Neutral whites, soft contrast, restrained warm timber."
  },
  {
    "id": "japandi",
    "name": "Japandi",
    "kind": "design",
    "atmosphere": "filtered daylight",
    "palette": [
      "smoked oak",
      "linen",
      "clay",
      "warm off-white"
    ],
    "roughness_start_range": [
      0.55,
      0.9
    ],
    "displacement_relief_mm": [
      0.1,
      0.7
    ],
    "lighting_recipe": "Soft directional daylight, low contrast practicals; readable alcoves.",
    "camera_guidance": "Quiet framing, natural eye height; retain windows and circulation.",